{
  "schema_version": 1,
  "run_id": "pi-moonleaf-review",
  "title": "Supervised Pi review of a fictional remediation plan",
  "objective": "Review this fictional Moonleaf proposal: defer notification permission until after a user saves a first plant and selects a care window; show a short pre-permission explanation; preserve a visible skip path; allow reminders to be enabled later. Produce a concise review covering alignment, one important risk, acceptance criteria, and the next human validation gate. Moonleaf and all scenario details are synthetic. Do not claim user research, production evidence, or measured impact.",
  "synthetic_demonstration": true,
  "allowed_paths": ["workspace/pi-smoke"],
  "stop_conditions": {
    "max_tasks": 1,
    "max_failures": 1,
    "max_runtime_seconds": 180
  },
  "tasks": [
    {
      "id": "review-moonleaf-plan",
      "title": "Review the fictional Moonleaf remediation plan",
      "kind": "review",
      "outputs": ["workspace/pi-smoke/assessment.md"],
      "depends_on": [],
      "timeout_seconds": 120,
      "retry": {"max_attempts": 1},
      "model_route": "review",
      "fresh_context": true,
      "settings": {}
    }
  ]
}
